[
 {
  "slug": "bourg-d-oisans",
  "name": "Bourg d'Oisans",
  "country": "FR",
  "lat": 45.055,
  "lon": 6.03,
  "tags": [
   "hub",
   "passes",
   "workshops",
   "events"
  ],
  "aliases": [
   "Oisans",
   "Le Bourg-d'Oisans",
   "Romanche"
  ],
  "why": "Basis für Alpe d'Huez, Galibier, Croix de Fer, Sarenne. Mehrere Rennradläden mit Werkstatt und Verleih, Marmotte-Zentrale."
 },
 {
  "slug": "briancon",
  "name": "Briançon",
  "country": "FR",
  "lat": 44.897,
  "lon": 6.636,
  "tags": [
   "passes",
   "workshops",
   "train"
  ],
  "aliases": [
   "Serre Chevalier",
   "Hautes-Alpes"
  ],
  "why": "Izoard, Lautaret/Galibier, Montgenèvre, Granon. Radläden, Bahnhof, höchste Stadt Frankreichs."
 },
 {
  "slug": "barcelonnette",
  "name": "Barcelonnette",
  "country": "FR",
  "lat": 44.387,
  "lon": 6.652,
  "tags": [
   "passes",
   "quiet",
   "scenic"
  ],
  "aliases": [
   "Ubaye",
   "Vallée de l'Ubaye"
  ],
  "why": "Bonette, Cayolle, Allos, Vars, Champs – sieben Pässe im Radius. Werkstätten, Rad-Unterkünfte."
 },
 {
  "slug": "bedoin",
  "name": "Bédoin",
  "country": "FR",
  "lat": 44.124,
  "lon": 5.179,
  "tags": [
   "hub",
   "season",
   "workshops"
  ],
  "aliases": [
   "Provence",
   "Vaucluse"
  ],
  "why": "Ventoux-Dorf: Verleih, Werkstatt, Cafés, Startort der klassischen Auffahrt."
 },
 {
  "slug": "saint-jean-de-maurienne",
  "name": "Saint-Jean-de-Maurienne",
  "country": "FR",
  "lat": 45.276,
  "lon": 6.347,
  "tags": [
   "hub",
   "passes",
   "train",
   "workshops"
  ],
  "aliases": [
   "Maurienne",
   "St-Jean-de-Maurienne",
   "Savoie"
  ],
  "why": "Croix de Fer, Madeleine, Télégraphe/Galibier; Bahnhof, Radläden, Maurienne-Radbüro."
 },
 {
  "slug": "bourg-saint-maurice",
  "name": "Bourg-Saint-Maurice",
  "country": "FR",
  "lat": 45.618,
  "lon": 6.769,
  "tags": [
   "passes",
   "train",
   "workshops"
  ],
  "aliases": [
   "Tarentaise",
   "Haute-Tarentaise",
   "Les Arcs",
   "Savoie"
  ],
  "why": "Haute-Tarentaise mit TGV-Anschluss: Iseran, Petit-St-Bernard, Cormet de Roselend und Les Arcs. Radläden mit Werkstatt und Verleih im Ort."
 },
 {
  "slug": "le-grand-bornand",
  "name": "Le Grand-Bornand",
  "country": "FR",
  "lat": 45.943,
  "lon": 6.429,
  "tags": [
   "passes",
   "scenic",
   "quiet"
  ],
  "aliases": [
   "Aravis",
   "Haute-Savoie",
   "Col de la Croix Fry"
  ],
  "why": "Aravis-Dorf: Colombière, Aravis und Croix Fry beginnen am Ort. Grüne Nebentäler, wenig Verkehr, Verleih im Dorf."
 },
 {
  "slug": "chambery",
  "name": "Chambéry",
  "country": "FR",
  "lat": 45.5667,
  "lon": 5.9208,
  "tags": [
   "hub",
   "train",
   "hotels",
   "workshops"
  ],
  "aliases": [
   "Savoie"
  ],
  "why": "Bahnknoten zwischen Bauges und Chartreuse: Granier, Plainpalais, Revard und Cucheron ab der Haustür, dazu Radläden und Hotels einer Stadt."
 },
 {
  "slug": "saint-pierre-de-chartreuse",
  "name": "Saint-Pierre-de-Chartreuse",
  "country": "FR",
  "lat": 45.3423,
  "lon": 5.8147,
  "tags": [
   "passes",
   "quiet",
   "scenic"
  ],
  "aliases": [
   "Chartreuse"
  ],
  "why": "Das Dorf mitten in der Chartreuse, an dem Cucheron, Coq und Porte zusammenlaufen; ruhige Unterkünfte statt Stadtbetrieb."
 },
 {
  "slug": "morzine",
  "name": "Morzine",
  "country": "FR",
  "lat": 46.18,
  "lon": 6.7,
  "tags": [
   "hub",
   "passes",
   "workshops"
  ],
  "aliases": [
   "Chablais",
   "Portes du Soleil",
   "Avoriaz",
   "Haute-Savoie"
  ],
  "why": "Chablais-Klassiker: Joux-Plane, Ramaz, Avoriaz und Joux Verte ab dem Ort. Dichte Radszene mit Läden, Verleih und Werkstätten."
 },
 {
  "slug": "guillestre",
  "name": "Guillestre",
  "country": "FR",
  "lat": 44.66,
  "lon": 6.648,
  "tags": [
   "passes",
   "quiet",
   "scenic"
  ],
  "aliases": [
   "Queyras",
   "Guillestrois",
   "Hautes-Alpes"
  ],
  "why": "Tor zum Queyras: Izoard, Vars, Agnel und Risoul, dazu die ruhige Schlucht des Guil. Campingplätze und kleine Radläden statt Skiort-Betrieb."
 },
 {
  "slug": "gap",
  "name": "Gap",
  "country": "FR",
  "lat": 44.5594,
  "lon": 6.0786,
  "tags": [
   "hub",
   "train",
   "hotels",
   "workshops"
  ],
  "aliases": [
   "Champsaur",
   "Gapençais"
  ],
  "why": "Die Stadt am Tor zum Champsaur: Manse, Noyer, Chaillol und Orcières in Reichweite, Bahnhof, Radläden und Hotels."
 },
 {
  "slug": "sospel",
  "name": "Sospel",
  "country": "FR",
  "lat": 43.877,
  "lon": 7.447,
  "tags": [
   "season",
   "quiet",
   "train",
   "scenic"
  ],
  "aliases": [
   "Alpes-Maritimes",
   "Côte d'Azur",
   "Bévéra",
   "Seealpen"
  ],
  "why": "Hinterland der Côte d'Azur: Turini, Braus, Brouis und Madone. Bahnhof an der Linie Nizza–Tende und ein Klima, das fast das ganze Jahr fahrbar ist."
 },
 {
  "slug": "bormio",
  "name": "Bormio",
  "country": "IT",
  "lat": 46.468,
  "lon": 10.372,
  "tags": [
   "hub",
   "passes",
   "workshops"
  ],
  "aliases": [
   "Valtellina",
   "Veltlin",
   "Alta Valtellina"
  ],
  "why": "Stelvio, Gavia, Mortirolo, Foscagno. Viele Radgeschäfte, Verleih, Bike-Hotels, Thermen."
 },
 {
  "slug": "livigno",
  "name": "Livigno",
  "country": "IT",
  "lat": 46.538,
  "lon": 10.135,
  "tags": [
   "passes",
   "hotels",
   "workshops"
  ],
  "aliases": [
   "Klein-Tibet",
   "Lombardei"
  ],
  "why": "Höhentraining-Ort, Bike-Hotels, Werkstätten; Foscagno, Bernina, Forcola."
 },
 {
  "slug": "morbegno",
  "name": "Morbegno",
  "country": "IT",
  "lat": 46.137,
  "lon": 9.572,
  "tags": [
   "passes",
   "train",
   "season"
  ],
  "aliases": [
   "Valtellina",
   "Veltlin",
   "Val Gerola",
   "Valchiavenna"
  ],
  "why": "Tiefer Einstieg in die Valtellina: San Marco, Vivione und die Anfahrt Richtung Aprica. Bahn bis in den Ort, im Frühjahr und Spätherbst fahrbar."
 },
 {
  "slug": "ponte-di-legno",
  "name": "Ponte di Legno",
  "country": "IT",
  "lat": 46.259,
  "lon": 10.508,
  "tags": [
   "passes",
   "hotels",
   "workshops"
  ],
  "aliases": [
   "Val Camonica",
   "Valcamonica"
  ],
  "why": "Gavia, Tonale, Mortirolo; Radläden, ruhiger als Bormio."
 },
 {
  "slug": "prad-am-stilfserjoch",
  "name": "Prad am Stilfserjoch",
  "country": "IT",
  "lat": 46.618,
  "lon": 10.594,
  "tags": [
   "passes",
   "season",
   "quiet"
  ],
  "aliases": [
   "Prato allo Stelvio",
   "Vinschgau",
   "Val Venosta"
  ],
  "why": "Fuß der 48 Kehren, Umbrail, Vinschgau-Radweg; Verleih und Werkstätten."
 },
 {
  "slug": "meran-merano",
  "name": "Meran / Merano",
  "country": "IT",
  "lat": 46.6713,
  "lon": 11.1596,
  "tags": [
   "hub",
   "season",
   "train",
   "workshops"
  ],
  "aliases": [
   "Passeiertal",
   "Val Passiria",
   "Etschtal",
   "Burggrafenamt"
  ],
  "why": "Milder Talort für die lange Saison: Jaufen, Timmelsjoch, Gampenjoch und der Vinschgau ab der Haustür. Bahnanschluss, Radläden, Radhotels."
 },
 {
  "slug": "corvara-alta-badia",
  "name": "Corvara / Alta Badia",
  "country": "IT",
  "lat": 46.549,
  "lon": 11.874,
  "tags": [
   "hub",
   "passes",
   "hotels",
   "events"
  ],
  "aliases": [
   "Val Badia",
   "Gadertal",
   "Kolfuschg",
   "Colfosco"
  ],
  "why": "Sellaronda- und Maratona-Zentrum: Bike-Hotels, Verleih, Werkstätten, Servicepoints an den Pässen."
 },
 {
  "slug": "arabba",
  "name": "Arabba",
  "country": "IT",
  "lat": 46.4972,
  "lon": 11.8703,
  "tags": [
   "passes",
   "hotels",
   "scenic"
  ],
  "aliases": [
   "Buchenstein",
   "Livinallongo",
   "Sellaronda"
  ],
  "why": "Mitten in der Sellaronda: Pordoi, Campolongo, Falzarego/Valparola und Fedaia beginnen am Ort. Bike-Hotels mit Radkeller, Verleih an der Talstation."
 },
 {
  "slug": "canazei",
  "name": "Canazei",
  "country": "IT",
  "lat": 46.477,
  "lon": 11.77,
  "tags": [
   "hub",
   "passes",
   "hotels"
  ],
  "aliases": [
   "Val di Fassa",
   "Fassatal",
   "Campitello di Fassa"
  ],
  "why": "Sella, Pordoi, Fedaia, San Pellegrino; Radläden, Sellaronda-Startort."
 },
 {
  "slug": "wolkenstein-selva",
  "name": "Wolkenstein / Selva di Val Gardena",
  "country": "IT",
  "lat": 46.5556,
  "lon": 11.7597,
  "tags": [
   "passes",
   "hotels",
   "scenic"
  ],
  "aliases": [
   "Gröden",
   "Groeden",
   "Val Gardena",
   "Sellaronda"
  ],
  "why": "Grödner Talschluss: Sella und Grödner Joch beginnen am Ort, Erbe/Würzjoch und die Sellaronda schließen an. Viele Bike-Hotels, Verleih und Werkstätten."
 },
 {
  "slug": "cortina-d-ampezzo",
  "name": "Cortina d'Ampezzo",
  "country": "IT",
  "lat": 46.538,
  "lon": 12.136,
  "tags": [
   "passes",
   "hotels",
   "scenic"
  ],
  "aliases": [
   "Cadore",
   "Ampezzo",
   "Boite"
  ],
  "why": "Giau, Falzarego, Tre Cime, Cimabanche; Radläden, große Auswahl an Unterkünften."
 },
 {
  "slug": "alleghe-caprile",
  "name": "Alleghe / Caprile",
  "country": "IT",
  "lat": 46.4093,
  "lon": 12.0219,
  "tags": [
   "passes",
   "scenic",
   "quiet"
  ],
  "aliases": [
   "Agordino",
   "Cordevole",
   "Civetta"
  ],
  "why": "Ruhige Basis unter der Civetta: Fedaia ab Caprile, dazu Giau, Staulanza und Duran. Wenig Durchgangsverkehr, See und Dolomitenwände direkt vor der Tür."
 },
 {
  "slug": "san-martino-di-castrozza",
  "name": "San Martino di Castrozza",
  "country": "IT",
  "lat": 46.2622,
  "lon": 11.8003,
  "tags": [
   "passes",
   "scenic",
   "quiet"
  ],
  "aliases": [
   "Primiero",
   "Pale di San Martino",
   "Passo Cereda"
  ],
  "why": "Südrampe des Rolle unter den Palagruppen: Rolle, Cereda und Croce d'Aune. Ruhig, landschaftlich außergewöhnlich, Hotels aus dem Skibetrieb."
 },
 {
  "slug": "cavalese",
  "name": "Cavalese",
  "country": "IT",
  "lat": 46.2893,
  "lon": 11.461,
  "tags": [
   "passes",
   "quiet",
   "hotels"
  ],
  "aliases": [
   "Val di Fiemme",
   "Fleimstal",
   "Predazzo"
  ],
  "why": "Fleimstal als ruhige Talbasis: Manghen, Lavazè, Rolle und San Pellegrino in Reichweite, dazu flache Talstraßen für den Tag danach."
 },
 {
  "slug": "toblach-dobbiaco",
  "name": "Toblach / Dobbiaco",
  "country": "IT",
  "lat": 46.7358,
  "lon": 12.2214,
  "tags": [
   "train",